{
  "$schema": "../../schema/aggregate_score_proposal.schema.json",
  "proposal_schema_version": "v0.1.0",
  "proposal_id": "overall_anx_score_v0_8_preregistered_template",
  "proposal_status": "preregistered_template",
  "benchmark_version_target": "v0.8",
  "proposal_date": "2026-06-16",
  "preregistration_date": "2026-06-16",
  "source_bridge_evidence": {
    "bridge_evidence_path": "validation/v0.7/cross_domain_bridge/wave7_bridge_evidence.json",
    "bridge_evidence_id": null,
    "required_bridge_decision": "bridge_supported_for_overall_readiness_review",
    "observed_bridge_required": true,
    "bridge_evidence_status": null,
    "bridge_decision": null,
    "bridge_scoring_authorized": null,
    "bridge_evidence_is_authorization": false
  },
  "contributing_constructs": [
    {
      "construct_id": "somatic_ambient_anxiety",
      "domain_id": "somatic_ambient",
      "source_release": null,
      "source_construct_approval": {
        "approval_status": null,
        "approved_for_aggregate_source": null,
        "approval_artifact_path": null,
        "approval_date": null
      },
      "included_item_ids": [
        "sleep_disruption_ai_news",
        "body_vigilance_model_release",
        "background_dread_ai_progress",
        "avoidance_after_ai_capability_demo"
      ],
      "bridge_role": "source-scored somatic anchor construct from the Wave 7 bridge packet; aggregate-source approval remains unset in this template",
      "minimum_items_required": 4
    },
    {
      "construct_id": "economic_vocational_anxiety",
      "domain_id": "economic_vocational",
      "source_release": null,
      "source_construct_approval": {
        "approval_status": null,
        "approved_for_aggregate_source": null,
        "approval_artifact_path": null,
        "approval_date": null
      },
      "included_item_ids": [
        "skill_obsolescence_software",
        "wage_pressure_customer_support",
        "retraining_pressure_accounting",
        "status_loss_creative_work"
      ],
      "bridge_role": "candidate economic-vocational construct from the Wave 7 bridge packet; scored source approval remains unset in this template",
      "minimum_items_required": 3
    },
    {
      "construct_id": "epistemic_trust_anxiety",
      "domain_id": "epistemic",
      "source_release": null,
      "source_construct_approval": {
        "approval_status": null,
        "approved_for_aggregate_source": null,
        "approval_artifact_path": null,
        "approval_date": null
      },
      "included_item_ids": [
        "deepfake_evidence_trust",
        "synthetic_news_provenance",
        "ai_expert_claim_conflict",
        "personalized_misinformation_targeting"
      ],
      "bridge_role": "candidate epistemic-trust construct from the Wave 7 bridge packet; scored source approval remains unset in this template",
      "minimum_items_required": 3
    }
  ],
  "contributing_items": [
    {
      "item_id": "sleep_disruption_ai_news",
      "item_version": "v0.2.0",
      "construct_id": "somatic_ambient_anxiety",
      "domain_id": "somatic_ambient",
      "source_item_status": null,
      "scoring_key_version_locked": null
    },
    {
      "item_id": "body_vigilance_model_release",
      "item_version": "v0.2.0",
      "construct_id": "somatic_ambient_anxiety",
      "domain_id": "somatic_ambient",
      "source_item_status": null,
      "scoring_key_version_locked": null
    },
    {
      "item_id": "background_dread_ai_progress",
      "item_version": "v0.2.0",
      "construct_id": "somatic_ambient_anxiety",
      "domain_id": "somatic_ambient",
      "source_item_status": null,
      "scoring_key_version_locked": null
    },
    {
      "item_id": "avoidance_after_ai_capability_demo",
      "item_version": "v0.2.0",
      "construct_id": "somatic_ambient_anxiety",
      "domain_id": "somatic_ambient",
      "source_item_status": null,
      "scoring_key_version_locked": null
    },
    {
      "item_id": "skill_obsolescence_software",
      "item_version": "v0.1.0",
      "construct_id": "economic_vocational_anxiety",
      "domain_id": "economic_vocational",
      "source_item_status": null,
      "scoring_key_version_locked": null
    },
    {
      "item_id": "wage_pressure_customer_support",
      "item_version": "v0.1.0",
      "construct_id": "economic_vocational_anxiety",
      "domain_id": "economic_vocational",
      "source_item_status": null,
      "scoring_key_version_locked": null
    },
    {
      "item_id": "retraining_pressure_accounting",
      "item_version": "v0.1.0",
      "construct_id": "economic_vocational_anxiety",
      "domain_id": "economic_vocational",
      "source_item_status": null,
      "scoring_key_version_locked": null
    },
    {
      "item_id": "status_loss_creative_work",
      "item_version": "v0.1.0",
      "construct_id": "economic_vocational_anxiety",
      "domain_id": "economic_vocational",
      "source_item_status": null,
      "scoring_key_version_locked": null
    },
    {
      "item_id": "deepfake_evidence_trust",
      "item_version": "v0.1.0",
      "construct_id": "epistemic_trust_anxiety",
      "domain_id": "epistemic",
      "source_item_status": null,
      "scoring_key_version_locked": null
    },
    {
      "item_id": "synthetic_news_provenance",
      "item_version": "v0.1.0",
      "construct_id": "epistemic_trust_anxiety",
      "domain_id": "epistemic",
      "source_item_status": null,
      "scoring_key_version_locked": null
    },
    {
      "item_id": "ai_expert_claim_conflict",
      "item_version": "v0.1.0",
      "construct_id": "epistemic_trust_anxiety",
      "domain_id": "epistemic",
      "source_item_status": null,
      "scoring_key_version_locked": null
    },
    {
      "item_id": "personalized_misinformation_targeting",
      "item_version": "v0.1.0",
      "construct_id": "epistemic_trust_anxiety",
      "domain_id": "epistemic",
      "source_item_status": null,
      "scoring_key_version_locked": null
    }
  ],
  "scoring_model": {
    "model_family": "Construct-first observed-score mean model. Each contributing construct is scored as the arithmetic mean of its approved non-reverse-coded 1 to 5 item scores, then the overall ANX candidate score is the arithmetic mean of the approved somatic, economic, and epistemic construct means. No IRT theta, factor-score, empirical Bayes, rank-normalized, residualized, or post hoc optimized scoring is used for the primary estimand.",
    "estimand": "The v0.8 candidate overall ANX estimand is the population mean of a respondent-level construct-balanced observed-score index across approved somatic ambient anxiety, economic vocational anxiety, and epistemic trust anxiety source constructs. For respondent i, Overall ANX_i = mean(Somatic_i, Economic_i, Epistemic_i) when all three approved construct means satisfy retained-item rules. The target quantity for a release estimate is the survey-weighted population mean of Overall ANX_i among eligible respondents in the release-defined population, subject to invariance and DIF claim limits.",
    "score_scale": "Observed-score 1 to 5 scale, where 1 is the minimum possible observed item response and 5 is the maximum possible observed item response. Construct means and the overall candidate score remain on this 1 to 5 metric. Scores are not transformed to theta, z scores, percentiles, clinical categories, prevalence categories, or risk strata for the primary scoring model.",
    "aggregation_sequence": [
      "Validate that each source construct has independent approval for aggregate-source use in a later citable release; this template alone does not grant that approval.",
      "For each eligible respondent, score approved ANX items on their locked 1 to 5 observed-response keys.",
      "Within each approved construct, compute the respondent construct mean from retained item scores only when the construct-specific minimum retained-item rule is met.",
      "Compute the respondent-level candidate overall ANX score as an equal-weight arithmetic mean of the retained somatic_ambient_anxiety, economic_vocational_anxiety, and epistemic_trust_anxiety construct means.",
      "Estimate release-level population quantities from respondent-level overall scores using the preregistered survey design and population weights when such weights are available and release-approved.",
      "Report sensitivity estimates using unweighted and reliability-weighted variants without replacing the equal-domain primary estimand."
    ],
    "source_score_inputs": [
      "somatic_ambient_anxiety construct mean from approved somatic_ambient source items only",
      "economic_vocational_anxiety construct mean from approved economic_vocational source items only",
      "epistemic_trust_anxiety construct mean from approved epistemic source items only"
    ],
    "release_authorization": {
      "release_approval_required": true,
      "release_manifest_path": null,
      "scoring_authorized": false
    }
  },
  "weights": {
    "construct_weighting": "Primary respondent-level scoring uses equal construct weights: one third somatic_ambient_anxiety, one third economic_vocational_anxiety, and one third epistemic_trust_anxiety. Because the v0.8 candidate uses one approved construct per domain, construct weights and domain weights are identical in the primary model. No construct weight may be estimated from observed outcome associations, subgroup differences, reliability alone, factor loadings, or predictive performance for the primary estimand.",
    "domain_weighting": "Primary domain weighting is equal across the three approved domains: somatic_ambient, economic_vocational, and epistemic each contribute one third of the respondent-level candidate overall score. Equal domain weights encode the construct-balanced estimand and prevent domains with more items or stronger covariance from dominating the overall value.",